{
  "schema": "health-splunk-check/v2",
  "source": "splunk",
  "watch_id": "2026-08-30T18-45-00Z",
  "checked_at": "2026-08-30T18:45:00Z",
  "ok": true,
  "status": "ok",
  "headline": "A BGP neighbor came Up since the prior stamp. No interface went down and nobody committed config, so the adjacency recovered without a config change.",
  "window": "2026-08-30T04:03:20Z",
  "window_start": "2026-08-30T04:03:20Z",
  "window_end": "2026-08-30T18:45:00Z",
  "coverage": { "state": "complete" },
  "vs_prior": {
    "prior_watch_id": "2026-08-30T04-03-20Z",
    "delta": "worse",
    "changed": [
      "<inventory-name> bgp neighbor <neighbor-id> Up 0 → 1",
      "<inventory-name> bgp_adjchange 0 → 1"
    ]
  },
  "metrics": [
    {
      "at": "2026-08-30T18:45:00Z",
      "scope": "device:<inventory-name>",
      "name": "<inventory-name>",
      "bgp_adjchange": 1,
      "link_updown": 0,
      "config_i": 0
    }
  ],
  "readings": [
    {
      "name": "<inventory-name>",
      "kind": "bgp",
      "subject": "neighbor <neighbor-id> Up",
      "keys": ["device:<inventory-name>"],
      "count": 1,
      "note": "BGP neighbor went Up (0 to 1) since the prior stamp. No LINEPROTO up/down and no CONFIG_I on this device, so the session recovered and this window has no config commit."
    }
  ]
}
